{
  "$schema": "../schema/videos.schema.json",
  "generated_at": "2026-10-19T21:53:59Z",
  "last_synced_at": "2026-10-13T13:05:05Z",
  "source_query": "from:ofc_shokuzai has:videos -is:retweet",
  "videos": [
    {
      "id": "2109993830561071514",
      "url": "https://x.com/ofc_shokuzai/status/2109993830561071514",
      "posted_at": "2026-10-13T13:05:05Z",
      "duration_sec": 251,
      "text": "【🎥ライブ映像公開】\n2026.10.13 (TUE) 新宿MARZ\n美味しいイベント -美味しい贖罪 定期主催-の様子を一部公開！🎃\n#美味しい贖罪 https://t.co/KXvqSQPqAI",
      "tags": []
    },
    {
      "id": "2097671065883603444",
      "url": "https://x.com/ofc_shokuzai/status/2097671065883603444",
      "posted_at": "2026-09-09T12:58:49Z",
      "duration_sec": 299,
      "text": "【🎥ライブ映像公開】\n2026.09.09(WED) Shibuya Milkyway\n「美味しいイベント」-美味しい贖罪・定期主催-の映像を一部公開！\n＃美味しい贖罪 https://t.co/pD3aqaDlYB",
      "tags": []
    },
    {
      "id": "2092945571854389595",
      "url": "https://x.com/ofc_shokuzai/status/2092945571854389595",
      "posted_at": "2026-08-27T12:01:24Z",
      "duration_sec": 48,
      "text": "#美味しい贖罪\n2026/12/08(火)BLAZE GOTANDA\n贖罪なワンマン2 -新約と洗礼、祝祭の黙示録-\n\nオフィシャル抽選先行\n2026/08/30(日) 23:59まで🕯 https://t.co/ujgu3VBWB4",
      "tags": []
    },
    {
      "id": "2088246941104926751",
      "url": "https://x.com/official_aimai/status/2088246941104926751",
      "posted_at": "2026-08-14T12:50:43Z",
      "duration_sec": 281,
      "text": "2026.08.14(FRI) Shibuya Milkyway 美味しいイベント -美味しい贖罪 定期主催-\n#美味しい贖罪 https://t.co/eWdMdUiBpB",
      "tags": []
    },
    {
      "id": "2070484495447568453",
      "url": "https://x.com/official_aimai/status/2070484495447568453",
      "posted_at": "2026-06-26T12:29:06Z",
      "duration_sec": 267,
      "text": "2026.06.26(FRI)渋谷音楽堂\n「贖罪なワンマン1」\n-黒衣の深淵、終末の聖歌- の映像を一部公開！\n#美味しい贖罪 https://t.co/WVonetsLPw",
      "tags": []
    },
    {
      "id": "2069383378907066826",
      "url": "https://x.com/official_aimai/status/2069383378907066826",
      "posted_at": "2026-06-23T11:33:39Z",
      "duration_sec": 21,
      "text": "✝️ 2026/06/23(火)\n\nQUEEN LAND VOL.6\n下北沢シャングリラ\n\nご来場いただきありがとうございました🕯\n\n⏬次回のライブ\n\n2026/06/26(金)\n\n「贖罪なワンマン1」\n-黒衣の深淵、終末の聖歌-\n\n渋谷音楽堂\n\n🎫 https://t.co/IrsHMap5O3 https://t.co/PYhHT3qquA",
      "tags": []
    },
    {
      "id": "2067948191132340601",
      "url": "https://x.com/official_aimai/status/2067948191132340601",
      "posted_at": "2026-06-19T12:30:44Z",
      "duration_sec": 55,
      "text": "「贖罪なワンマン1」-黒衣の深淵、終末の聖歌-まであと1週間✝️\nメンバーからのメッセージ動画をお届けします🕯 https://t.co/55CsBJvc9m",
      "tags": []
    },
    {
      "id": "2064997414361288769",
      "url": "https://x.com/official_aimai/status/2064997414361288769",
      "posted_at": "2026-06-11T09:05:24Z",
      "duration_sec": 80,
      "text": "2026.06.10 (WED) SHIBUYA CYCLONE\n#ﾆｷﾌﾟﾚ『カンシャサイ。-夏-』 SHIBUYA CYCLONE\nより新曲「L'Oiel」の映像を一部公開！\n＃美味しい贖罪 https://t.co/yJaQauARKe",
      "tags": []
    },
    {
      "id": "2064996065900650869",
      "url": "https://x.com/official_aimai/status/2064996065900650869",
      "posted_at": "2026-06-11T09:00:02Z",
      "duration_sec": 80,
      "text": "2026.06.10 (WED) SHIBUYA CYCLONE\n#ﾆｷﾌﾟﾚ『カンシャサイ。-夏-』 SHIBUYA CYCLONE\nより新曲「L'Oiel」の映像を一部公開！ https://t.co/cAlnYtbESf",
      "tags": []
    },
    {
      "id": "2051634264542970105",
      "url": "https://x.com/official_aimai/status/2051634264542970105",
      "posted_at": "2026-05-05T12:05:00Z",
      "duration_sec": 225,
      "text": "2026.05.05(TUE)\nSHIBUYA TAKE OFF 7\n「美味しいイベント」\n-ワンコインディナー- の映像を一部公開。\n\nそして本日！\n新曲「MOSAIQ」を初披露させていただきました！\n\n#美味しい贖罪 https://t.co/Tax6PXy7Pp",
      "tags": []
    },
    {
      "id": "2044058617503199246",
      "url": "https://x.com/official_aimai/status/2044058617503199246",
      "posted_at": "2026-04-14T14:22:05Z",
      "duration_sec": 75,
      "text": "【🎥ライブ映像公開】\n2026.04.14(TUE) SHIBUYA THE GAME\nMade in Maiden定期主催Live「alphaism Vol.7」より\n新曲「シカクと詭弁」の映像を一部公開！\n\n#美味しい贖罪 https://t.co/OgpX81LHLl",
      "tags": []
    },
    {
      "id": "1998025160025424360",
      "url": "https://x.com/official_aimai/status/1998025160025424360",
      "posted_at": "2025-12-08T13:41:34Z",
      "duration_sec": 131,
      "text": "2025.12.08(MON)\n美味しい贖罪 始動主催公演\n「邂逅」\nat 高田馬場CLUB PHASE https://t.co/LPYwi8tSne",
      "tags": []
    },
    {
      "id": "1997637221147443419",
      "url": "https://x.com/official_aimai/status/1997637221147443419",
      "posted_at": "2025-12-07T12:00:02Z",
      "duration_sec": 24,
      "text": "✝︎┈┈┈┈┈┈┈┈┈┈\n\n　　美味しい贖罪\n\n┈┈┈┈┈┈┈┈┈┈✝︎ https://t.co/SpnY49fSPX",
      "tags": []
    },
    {
      "id": "1997274960151318778",
      "url": "https://x.com/official_aimai/status/1997274960151318778",
      "posted_at": "2025-12-06T12:00:32Z",
      "duration_sec": 24,
      "text": "✝︎┈┈┈┈┈┈┈┈┈┈\n\n　　切兎うずめ\n\n┈┈┈┈┈┈┈┈┈┈✝︎ https://t.co/llHMJvYLgl",
      "tags": []
    },
    {
      "id": "1996912449535254678",
      "url": "https://x.com/official_aimai/status/1996912449535254678",
      "posted_at": "2025-12-05T12:00:03Z",
      "duration_sec": 24,
      "text": "✝︎┈┈┈┈┈┈┈┈┈┈\n\n　　可惜世りな\n\n┈┈┈┈┈┈┈┈┈┈✝︎ https://t.co/t0gA7gQLfp",
      "tags": []
    },
    {
      "id": "1995100506054860903",
      "url": "https://x.com/official_aimai/status/1995100506054860903",
      "posted_at": "2025-11-30T12:00:02Z",
      "duration_sec": 24,
      "text": "✝︎┈┈┈┈┈┈┈┈┈┈\n\n　　鴉羽りょう\n\n┈┈┈┈┈┈┈┈┈┈✝︎ https://t.co/25zNWGdd3A",
      "tags": []
    },
    {
      "id": "1994738115269816439",
      "url": "https://x.com/official_aimai/status/1994738115269816439",
      "posted_at": "2025-11-29T12:00:01Z",
      "duration_sec": 18,
      "text": "✝︎┈┈┈┈┈┈┈┈┈┈\n\n        蘭赦染みるも\n\n┈┈┈┈┈┈┈┈┈┈✝︎ https://t.co/wgOqtVwbB1",
      "tags": []
    },
    {
      "id": "1994375729933328525",
      "url": "https://x.com/official_aimai/status/1994375729933328525",
      "posted_at": "2025-11-28T12:00:02Z",
      "duration_sec": 19,
      "text": "✝︎┈┈┈┈┈┈┈┈┈┈\n\n        宵闇ねむり\n\n┈┈┈┈┈┈┈┈┈┈✝︎ https://t.co/thrSRitUFl",
      "tags": []
    },
    {
      "id": "1993681241632370742",
      "url": "https://x.com/official_aimai/status/1993681241632370742",
      "posted_at": "2025-11-26T14:00:23Z",
      "duration_sec": 13,
      "text": "𝐜𝐨𝐦𝐢𝐧𝐠 𝐬𝐨𝐨𝐧… https://t.co/U7HBJxI6G9",
      "tags": []
    },
    {
      "id": "1969733817994014902",
      "url": "https://x.com/official_aimai/status/1969733817994014902",
      "posted_at": "2025-09-21T12:01:52Z",
      "duration_sec": 12,
      "text": "✟ ✞ ✟ ✞ ✟ ✞ ✟ ✞ ✟ ✞ ✟ ✞ ✟ ✞ ✟ ✞ ✟ \n\n　「贖いの聖歌、赦しを舞う」\n\n　　2025年12月8日(月)\n                 正式始動\n\n✟ ✞ ✟ ✞ ✟ ✞ ✟ ✞ ✟ ✞ ✟ ✞ ✟ ✞ ✟ ✞ ✟ https://t.co/VeO1Aq8usu",
      "tags": []
    }
  ]
}
